{"schema_version": "ecl_action_register_v1", "register_id": "urn:example:register:bundle", "register_version": "1", "system_of_interest": {"uri": "urn:example:soi:bundle", "digest": {"algorithm": "ecl.digest.sha-256.v1", "value": "6666666666666666666666666666666666666666666666666666666666666666"}}, "generated_at": "2026-09-01T00:00:00Z", "capability_inventory": {"uri": "urn:example:capability-inventory:bundle", "digest": {"algorithm": "ecl.digest.sha-256.v1", "value": "6666666666666666666666666666666666666666666666666666666666666666"}}, "entries": [{"action_class_id": "ecl.action.ai-proposed-operation.v1", "classification": "consequential", "rationale": "The test action updates a record outside the agent's context.", "consequence_dimensions": ["external_state_mutation"], "affected_resources": ["urn:example:record:bundle-r1"], "actor_subject_classes": ["urn:example:principal:test-agent", "urn:example:principal:test-tenant"], "data_classes": [], "enforcement_class": "hard", "capability_paths": [{"path_id": "urn:example:path:bundle-records-update", "entry_point": "records tool update method", "effect_boundary": "record store write", "interceptor": {"uri": "urn:example:component:bundle-gate"}, "interception_result": "hard_mediated", "last_tested_at": "2026-09-01T00:00:00Z", "evidence": [{"uri": "urn:example:evidence:bundle-interception"}]}], "evidence_profile": "ecl.evidence.standard.v1", "decision_inputs": [{"input": "urn:example:input:bundle:grant", "class": "verifiable", "required": true, "source": "urn:example:policy-plane:bundle", "maximum_age_seconds": 60, "deadline_milliseconds": 250}, {"input": "urn:example:input:bundle:control-state", "class": "verifiable", "required": true, "source": "urn:example:emergency-plane:bundle", "maximum_age_seconds": 5, "deadline_milliseconds": 250}, {"input": "urn:example:input:bundle:anomaly-score", "class": "judgment", "required": false, "source": "urn:example:detector:bundle-anomaly", "maximum_age_seconds": 60, "deadline_milliseconds": 100}]}], "negative_boundary_annex": []}